{
  "schemaVersion": 2,
  "id": "local-dev-rnnt-mock",
  "version": "0.0.1",
  "displayName": "Local development RNN-T mock model",
  "languages": ["vi", "en"],
  "supportedLanguageModes": ["vi", "en", "auto", "mixed"],
  "architecture": "rnnt",
  "license": {
    "spdx": "Apache-2.0",
    "name": "Apache-2.0 generated mock ONNX test graphs",
    "noticeUrl": "../../MODEL_LICENSES.md",
    "redistributionAllowed": true
  },
  "sampleRateHz": 16000,
  "feature": {
    "type": "log-mel",
    "bins": 4,
    "frameLengthMs": 25,
    "frameShiftMs": 10,
    "fftSize": 512,
    "lowFreqHz": 20,
    "highFreqHz": 7600,
    "dither": 0,
    "snipEdges": false
  },
  "tokenizer": {
    "type": "tokens",
    "vocabularySize": 4,
    "byteFallback": true,
    "blankId": 0,
    "languageTokenIds": {
      "vi": 1,
      "en": 2,
      "mixed": 3
    }
  },
  "streaming": {
    "chunkFrames": 16,
    "chunkShiftFrames": 8,
    "rightContextFrames": 4,
    "maxSymbolsPerFrame": 3
  },
  "contextBiasing": {
    "supported": false,
    "algorithm": "token-trie",
    "maxActiveEntries": 0,
    "maxPhraseTokens": 0,
    "defaultWeight": 0,
    "maxCumulativeBonus": 0
  },
  "files": {
    "encoder": {
      "url": "files/encoder.onnx",
      "sha256": "013b5322684bab9d193baaf12bdd52d794e8e870b3fd3505e9280747a510e647",
      "sizeBytes": 156,
      "mediaType": "application/onnx"
    },
    "predictor": {
      "url": "files/predictor.onnx",
      "sha256": "ad2dead2da2bbe72b19af2adfe1f58e3743a3804cf56d273327b85ca3ab64779",
      "sizeBytes": 160,
      "mediaType": "application/onnx"
    },
    "joiner": {
      "url": "files/joiner.onnx",
      "sha256": "510d5d2b3d235fcc6553e56337be0cc172f0bcb65c3b60a388986c13db183485",
      "sizeBytes": 181,
      "mediaType": "application/onnx"
    }
  },
  "graphs": {
    "encoder": {
      "fileKey": "encoder",
      "inputs": [
        {
          "name": "features",
          "dataType": "float32",
          "shape": [1, 4],
          "description": "mock log-Mel feature vector"
        }
      ],
      "outputs": [
        {
          "name": "encoded",
          "dataType": "float32",
          "shape": [1, 4],
          "description": "mock encoder output"
        }
      ]
    },
    "predictor": {
      "fileKey": "predictor",
      "inputs": [
        {
          "name": "tokens",
          "dataType": "float32",
          "shape": [1, 4],
          "description": "mock predictor input vector"
        }
      ],
      "outputs": [
        {
          "name": "predicted",
          "dataType": "float32",
          "shape": [1, 4],
          "description": "mock predictor output"
        }
      ]
    },
    "joiner": {
      "fileKey": "joiner",
      "inputs": [
        {
          "name": "encoded",
          "dataType": "float32",
          "shape": [1, 4],
          "description": "mock encoder vector"
        },
        {
          "name": "predicted",
          "dataType": "float32",
          "shape": [1, 4],
          "description": "mock predictor vector"
        }
      ],
      "outputs": [
        {
          "name": "logits",
          "dataType": "float32",
          "shape": [1, 4],
          "description": "mock token logits"
        }
      ]
    }
  },
  "recommended": {
    "webgpu": false,
    "wasmThreads": 1,
    "expectedMemoryMb": 16
  }
}
